{
    "id" : 5,
    "name" : "NVIDIA GeForce RTX 3090",
    "package_params" : {
            "type" : "cardboard_box",
            "width" : 31,
            "height" : 14,
            "depth" : 10
        },
    "location_and_quantity" : [
        {
            "location" : "Магазин БытЭлектроника на Мира 55",
            "amount" : 1
        },
        {
            "location" : "Магазин БытЭлектроника микрорайон Восточный",
            "amount" : 2
        }

    ]
}